{
  "format": "woo-todo-webdav-operation",
  "protocolVersion": 1,
  "vaultId": "personal-vault",
  "deviceId": "device-mac-01",
  "opId": "op_01JZ7X0B8E6V5P4N3M2K",
  "entityId": "550e8400-e29b-41d4-a716-446655440000",
  "kind": "upsert",
  "lamport": 12,
  "nonce": "AAECAwQFBgcICQoL",
  "ciphertext": "VGhpcy1pcy1hLXRlc3QtY2lwaGVydGV4dC1hbmQtdGFnIQ"
}
